{
  "$schema": "../../../../../tools/schemas/lineage.schema.json",
  "version": 1,
  "id": "norse",
  "name": "Norse",
  "description": "Pray to Thor, Odin and Skadi.",
  "startingBlessing": "thor-vigour",
  "pool": ["berserker-blood", "skadi-hide", "thor-might", "thor-charge", "ymir-hide", "tyr-edge", "thor-hammerfall", "odin-leap", "tyr-strike"],
  "icon": "norse"
}
