{
  "$schema": "../../../../../tools/schemas/lineage.schema.json",
  "version": 1,
  "id": "hindu",
  "name": "Hindu",
  "description": "Pray to Agni, Vayu and Indra.",
  "startingBlessing": "vayu-breath",
  "pool": ["agni-warmth", "indra-wrath", "hanuman-heart", "agni-crown", "indra-mail", "vayu-haste", "agni-spark", "vayu-wings", "indra-storm"],
  "icon": "hindu"
}
