{
  "$schema": "../../../../../tools/schemas/lineage.schema.json",
  "version": 1,
  "id": "greek",
  "name": "Greek",
  "description": "Pray to Apollo, Athena and Hermes.",
  "startingBlessing": "athena-guard",
  "pool": ["apollo-eye", "zeus-favour", "hera-resolve", "apollo-bowstring", "athena-plating", "hermes-sandals", "zeus-bolt", "hermes-heels", "nike-jab"],
  "icon": "greek"
}
